### ISSUE TITLE
[master] zdtm/static/socket-tcpbuf{,6}-local fails

### ISSUE THREAD

**Issue by avagin** [xemul/criu#168]
https://ci.openvz.org/job/CRIU/job/CRIU-iter/branch/master/40/console
```
================== Run zdtm/static/socket-tcpbuf6-local in h ===================
Start test
./socket-tcpbuf6-local --pidfile=socket-tcpbuf6-local.pid --outfile=socket-tcpbuf6-local.out
Run criu dump
Run criu restore
Run criu dump
Run criu restore
Run criu dump
Run criu restore
Wait for zdtm/static/socket-tcpbuf6-local to die for 0.100000
Wait for zdtm/static/socket-tcpbuf6-local to die for 0.200000
Wait for zdtm/static/socket-tcpbuf6-local to die for 0.400000
Wait for zdtm/static/socket-tcpbuf6-local to die for 0.800000
Wait for zdtm/static/socket-tcpbuf6-local to die for 1.600000
Wait for zdtm/static/socket-tcpbuf6-local to die for 3.200000
Wait for zdtm/static/socket-tcpbuf6-local to die for 6.400000
Wait for zdtm/static/socket-tcpbuf6-local to die for 12.800000
Wait for zdtm/static/socket-tcpbuf6-local to die for 25.600000
 Test zdtm/static/socket-tcpbuf6-local FAIL at zdtm/static/socket-tcpbuf6-local die 
Wait for zdtm/static/socket-tcpbuf6-local to die for 0.100000
```

**Comment by avagin** [comment]
```
./socket-tcpbuf-local --pidfile=socket-tcpbuf-local.pid --outfile=socket-tcpbuf-local.out
Run criu dump
tcpdump: listening on any, link-type LINUX_SLL (Linux cooked), capture size 262144 bytes
=[log]=> dump/zdtm/static/socket-tcpbuf-local/25/1/dump.log
------------------------ grep Error ------------------------
(00.047295) Error (sk-tcp.c:375): rcv_nxt       3068997707 (               0) write_seq       3569022160 snd_una       3568563779 snd_nxt       3568563779
(00.066410) Error (sk-tcp.c:375): rcv_nxt        305047578 (               0) write_seq       3321506823 snd_una       3321506823 snd_nxt       3321506823
(00.125015) Error (sk-tcp.c:375): rcv_nxt       3568563779 (          748797) write_seq       3071617156 snd_una       3068997707 snd_nxt       3068997860
(00.157135) Error (sk-tcp.c:375): rcv_nxt       3321506823 (               0) write_seq        305047578 snd_una        305047578 snd_nxt        305047578
------------------------ ERROR OVER ------------------------
Run criu restore
Run criu dump
=[log]=> dump/zdtm/static/socket-tcpbuf-local/25/2/dump.log
------------------------ grep Error ------------------------
(00.057548) Error (sk-tcp.c:375): rcv_nxt       3070427332 (          303225) write_seq       3569022160 snd_una       3568758707 snd_nxt       3568758707
(00.079795) Error (sk-tcp.c:375): rcv_nxt        305047578 (               0) write_seq       3321506827 snd_una       3321506827 snd_nxt       3321506827
(00.121076) Error (sk-tcp.c:375): rcv_nxt       3568758707 (          943725) write_seq       3072099548 snd_una       3070427332 snd_nxt       3070427332
(00.158179) Error (sk-tcp.c:375): rcv_nxt       3321506827 (               0) write_seq        305047578 snd_una        305047578 snd_nxt        305047578
------------------------ ERROR OVER ------------------------
Run criu restore
Run criu dump
=[log]=> dump/zdtm/static/socket-tcpbuf-local/25/3/dump.log
------------------------ grep Error ------------------------
(00.044902) Error (sk-tcp.c:375): rcv_nxt       3070492308 (          368201) write_seq       3569022160 snd_una       3568802483 snd_nxt       3568823683
(00.067327) Error (sk-tcp.c:375): rcv_nxt        305047578 (               0) write_seq       3321506827 snd_una       3321506827 snd_nxt       3321506827
(00.107199) Error (sk-tcp.c:375): rcv_nxt       3568823683 (         1008701) write_seq       3072366210 snd_una       3070471108 snd_nxt       3070492308
(00.139286) Error (sk-tcp.c:375): rcv_nxt       3321506827 (               0) write_seq        305047578 snd_una        305047578 snd_nxt        305047578
------------------------ ERROR OVER ------------------------
Run criu restore
Wait for zdtm/static/socket-tcpbuf-local to die for 0.100000
Wait for zdtm/static/socket-tcpbuf-local to die for 0.200000
Wait for zdtm/static/socket-tcpbuf-local to die for 0.400000
Wait for zdtm/static/socket-tcpbuf-local to die for 0.800000
Wait for zdtm/static/socket-tcpbuf-local to die for 1.600000
Wait for zdtm/static/socket-tcpbuf-local to die for 3.200000
Wait for zdtm/static/socket-tcpbuf-local to die for 6.400000


21:46:02.189634 IP 127.0.0.1.46370 > 127.0.0.1.8880: Flags [.], ack 3568823683, win 342, options [nop,nop,TS val 39008 ecr 0], length 0
21:46:02.189753 IP 127.0.0.1.46372 > 127.0.0.1.8880: Flags [.], ack 3321506827, win 342, options [nop,nop,TS val 39073 ecr 0], length 0
21:46:02.189810 IP 127.0.0.1.8880 > 127.0.0.1.46372: Flags [.], ack 305047578, win 342, options [nop,nop,TS val 38848 ecr 0], length 0
21:46:02.189633 IP 127.0.0.1.8880 > 127.0.0.1.46370: Flags [.], ack 3070492308, win 342, options [nop,nop,TS val 38801 ecr 0], length 0
21:46:02.204425 IP 127.0.0.1.8880 > 127.0.0.1.46372: Flags [.], ack 305047578, win 342, options [nop,nop,TS val 38863 ecr 0], length 0
21:46:02.204480 IP 127.0.0.1.46372 > 127.0.0.1.8880: Flags [.], ack 3321506827, win 342, options [nop,nop,TS val 39088 ecr 38848], length 0
21:46:02.278269 IP 127.0.0.1.46372 > 127.0.0.1.8880: Flags [P.], seq 305047578:305047582, ack 3321506827, win 342, options [nop,nop,TS val 39162 ecr 38848], length 4
21:46:02.278387 IP 127.0.0.1.8880 > 127.0.0.1.46372: Flags [.], ack 305047582, win 342, options [nop,nop,TS val 38937 ecr 39162], length 0
21:46:02.296037 IP 127.0.0.1.8880 > 127.0.0.1.46372: Flags [P.], seq 3321506827:3321506831, ack 305047582, win 342, options [nop,nop,TS val 38954 ecr 39162], length 4
21:46:02.296172 IP 127.0.0.1.46372 > 127.0.0.1.8880: Flags [.], ack 3321506831, win 342, options [nop,nop,TS val 39180 ecr 38954], length 0
21:46:02.296215 IP 127.0.0.1.8880 > 127.0.0.1.46372: Flags [P.], seq 3321506831:3321506835, ack 305047582, win 342, options [nop,nop,TS val 38955 ecr 39180], length 4
21:46:02.296245 IP 127.0.0.1.46372 > 127.0.0.1.8880: Flags [.], ack 3321506835, win 342, options [nop,nop,TS val 39180 ecr 38955], length 0
21:46:02.296288 IP 127.0.0.1.46372 > 127.0.0.1.8880: Flags [P.], seq 305047582:305047586, ack 3321506835, win 342, options [nop,nop,TS val 39180 ecr 38955], length 4
21:46:02.296371 IP 127.0.0.1.8880 > 127.0.0.1.46372: Flags [F.], seq 3321506835, ack 305047586, win 342, options [nop,nop,TS val 38955 ecr 39180], length 0
21:46:02.336244 IP 127.0.0.1.46372 > 127.0.0.1.8880: Flags [.], ack 3321506836, win 342, options [nop,nop,TS val 39220 ecr 38955], length 0
21:46:05.080248 IP 127.0.0.1.8880 > 127.0.0.1.46370: Flags [.], seq 3568802483:3568803007, ack 3070492308, win 342, options [nop,nop,TS val 41692 ecr 0], length 524
21:46:05.080255 IP 127.0.0.1.46370 > 127.0.0.1.8880: Flags [.], seq 3070471108:3070471632, ack 3568823683, win 342, options [nop,nop,TS val 41899 ecr 0], length 524
21:46:05.080373 IP 127.0.0.1.46370 > 127.0.0.1.8880: Flags [.], ack 3568823683, win 342, options [nop,nop,TS val 41899 ecr 0,nop,nop,sack 1 {3568802483:3568803007}], length 0
21:46:05.080373 IP 127.0.0.1.8880 > 127.0.0.1.46370: Flags [.], ack 3070492308, win 342, options [nop,nop,TS val 41692 ecr 0,nop,nop,sack 1 {3070471108:3070471632}], length 0
21:46:05.085686 IP 127.0.0.1.46370 > 127.0.0.1.8880: Flags [.], ack 3568823683, win 342, options [nop,nop,TS val 41904 ecr 0], length 0
21:46:05.087538 IP 127.0.0.1.8880 > 127.0.0.1.46370: Flags [.], ack 3070492308, win 342, options [nop,nop,TS val 41699 ecr 0], length 0
```

**Comment by avagin** [comment]
packets were dropped in tcp_validate_incoming()

```
        /* Step 1: check sequence number */
        if (!tcp_sequence(tp, TCP_SKB_CB(skb)->seq, TCP_SKB_CB(skb)->end_seq)) {
```
Packets were out of window ([rcv_wup, rcv_nxt])

**Comment by avagin** [comment]
seq is set in  tcp_acceptable_seq()
```
static inline __u32 tcp_acceptable_seq(const struct sock *sk)
{
        const struct tcp_sock *tp = tcp_sk(sk);

        if (!before(tcp_wnd_end(tp), tp->snd_nxt))
                return tp->snd_nxt;
        else {
                return tcp_wnd_end(tp); <------------------ here
        }
}
```

A window size after restore is smaller than it was before dump
